{
  "schema_version": "gopulse.phase20.resource-budgets.v1",
  "contract_id": "phase20-05-budget-contract-20261002-r4",
  "candidate_version": "2.2.5",
  "dependencies": {
    "lockfile": "deploy/release/third-party.lock.json",
    "platform": "linux/amd64",
    "images": {
      "mysql": "mysql:8.4.0@sha256:dab7049abafe3a0e12cbe5e49050cf149881c0cd9665c289e5808b9dad39c9e0",
      "redis": "redis:7.2.5-alpine@sha256:6aaf3f5e6bc8a592fbfe2cccf19eb36d27c39d12dab4f4b01556b7449e7b1f44",
      "rabbitmq": "rabbitmq:3.13.3-management-alpine@sha256:45b2e137b64baeff1f7f4230588be8f1a08b16939a4b64f5da57c59e5dcd3282",
      "elasticsearch": "docker.elastic.co/elasticsearch/elasticsearch:9.5.2@sha256:9c1e1afc2bda921b35025e21c72ec6e392266995aa35ad6a47887363592718be",
      "kafka": "apache/kafka:4.3.1@sha256:77e3df9054047a88b520d0cc46e16696d3b22022e1d580aeccd2632df6532837",
      "victoria-metrics": "victoriametrics/victoria-metrics:v1.151.0@sha256:6d164540a04f49ba4e696cbdb70f9fee78be1e94b8f2a1292743a0b1ab8275bd",
      "trace-collector": "otel/opentelemetry-collector-contrib:0.138.0@sha256:d535a52679b1df0a95b1b6fc4322cb74ecddd61f0b550cb43444d2b22cedec0c"
    },
    "platform_digests": {
      "mysql": "sha256:3e5649c69e6d75cf88fc6f8f39f877453faa4e5167b5e648007e45f54bb17f6b",
      "redis": "sha256:015185fd658093359cc83aa8396e06c1f39ba36df3c93f79528ec23ab409e73f",
      "rabbitmq": "sha256:c01be497320fe7f7dbd599f4cea0b47098e397f122899d016638972d52c7e245",
      "elasticsearch": "sha256:4dd70111e8be29321bb7cdbc621032a77d5aec426e5f46522e05072056f912f7",
      "kafka": "sha256:ccd1314e47ec76909e01f86308b4dcf2064f19f7c89759234322314b0e319e26",
      "victoria-metrics": "sha256:fe3c311a3f1cddf52985dae7ceaf7de8aa111f5c5f591c81b6ab03b19bbeba19"
    }
  },
  "build_recipe": {
    "platform": "linux/amd64",
    "dockerfiles": {
      "application": "deploy/docker/backend.Dockerfile",
      "observability": "deploy/docker/observability.Dockerfile",
      "frontend": "deploy/docker/frontend.Dockerfile",
      "admin_frontend": "deploy/docker/admin-frontend.Dockerfile",
      "acceptance": "deploy/docker/acceptance.Dockerfile"
    },
    "targets": ["backend", "business-worker", "search-indexer", "router", "marshaller", "monitor", "redis-exporter", "frontend", "admin-frontend", "acceptance"],
    "tag_pattern": "phase20-05-<git revision prefix>",
    "build_args": ["VERSION", "REVISION", "TARGETARCH", "GOPROXY", "UPDATE_VERSION"],
    "network_mode": "host",
    "serial_build": true,
    "source_revision": "candidate manifest revision"
  },
  "platform": {
    "os": "Linux",
    "architecture": "amd64",
    "kernel_contains": "WSL2",
    "cpu_count_min": 8,
    "memory_bytes_min": 12884901888,
    "swap_bytes_min": 8589934592,
    "disk_free_bytes_min": 50000000000,
    "docker_server_os": "linux",
    "docker_server_arch": "amd64",
    "compose_version_min": "2.24.0"
  },
  "sampling": {
    "interval_seconds": 5,
    "missing_sample_max_ratio": 0.01,
    "stable_windows": {
      "early_start_minute": 10,
      "early_end_minute": 15,
      "late_start_minute": 55,
      "late_end_minute": 60
    },
    "normal_load": {
      "target_rps": 200,
      "warmup_seconds": 15,
      "measurement_seconds": 60,
      "repetitions": 3
    }
  },
  "compose_limits": {
    "mysql": { "cpus": 2.5, "memory_bytes": 2147483648, "scope": "steady_state" },
    "redis": { "cpus": 0.5, "memory_bytes": 268435456, "scope": "steady_state" },
    "rabbitmq": { "cpus": 2.0, "memory_bytes": 805306368, "scope": "steady_state" },
    "elasticsearch": { "cpus": 2.0, "memory_bytes": 2147483648, "scope": "steady_state" },
    "observability-elasticsearch": { "cpus": 2.0, "memory_bytes": 2147483648, "scope": "steady_state" },
    "migrate": { "cpus": 0.75, "memory_bytes": 402653184, "scope": "one_shot" },
    "search-init": { "cpus": 0.75, "memory_bytes": 402653184, "scope": "one_shot" },
    "backend": { "cpus": 4.5, "memory_bytes": 805306368, "scope": "steady_state" },
    "backend-2": { "cpus": 4.5, "memory_bytes": 805306368, "scope": "steady_state" },
    "business-worker": { "cpus": 1.0, "memory_bytes": 536870912, "scope": "steady_state" },
    "business-worker-2": { "cpus": 1.0, "memory_bytes": 536870912, "scope": "steady_state" },
    "search-indexer": { "cpus": 1.0, "memory_bytes": 536870912, "scope": "steady_state" },
    "search-indexer-2": { "cpus": 1.0, "memory_bytes": 536870912, "scope": "steady_state" },
    "admin-frontend": { "cpus": 0.5, "memory_bytes": 134217728, "scope": "steady_state" },
    "frontend": { "cpus": 0.5, "memory_bytes": 134217728, "scope": "steady_state" },
    "admin-role": { "cpus": 0.75, "memory_bytes": 402653184, "scope": "one_shot" },
    "acceptance": { "cpus": 0.25, "memory_bytes": 134217728, "scope": "acceptance" },
    "kafka": { "cpus": 2.5, "memory_bytes": 1073741824, "scope": "steady_state" },
    "kafka-init": { "cpus": 0.25, "memory_bytes": 134217728, "scope": "one_shot" },
    "victoriametrics": { "cpus": 1.0, "memory_bytes": 805306368, "scope": "steady_state" },
    "router": { "cpus": 0.75, "memory_bytes": 268435456, "scope": "steady_state" },
    "router-2": { "cpus": 0.75, "memory_bytes": 268435456, "scope": "steady_state" },
    "marshaller": { "cpus": 1.0, "memory_bytes": 402653184, "scope": "steady_state" },
    "marshaller-2": { "cpus": 1.0, "memory_bytes": 402653184, "scope": "steady_state" },
    "monitor": { "cpus": 1.5, "memory_bytes": 536870912, "scope": "steady_state" },
    "redis-exporter": { "cpus": 0.5, "memory_bytes": 134217728, "scope": "acceptance" },
    "phase20-collector": { "cpus": 0.25, "memory_bytes": 134217728, "scope": "acceptance" }
  },
  "budgets": [
    { "budget_id": "cpu.sut_peak_cores", "target": "sut_containers", "metric": "cpu_peak", "unit": "cores", "window": "normal_200_rps_60s", "aggregation": "peak", "comparison": "less_equal", "threshold": 8.75, "consecutive_samples": 3, "duration_seconds": 15, "over_limit_action": "stop_current_unit_and_preserve_samples", "recovery": "independent_empty_project_after_120s_waterline" },
    { "budget_id": "cpu.load_peak_cores", "target": "load_generator", "metric": "cpu_peak", "unit": "cores", "window": "normal_200_rps_60s", "aggregation": "peak", "comparison": "less_equal", "threshold": 1.5, "consecutive_samples": 3, "duration_seconds": 15, "over_limit_action": "mark_budget_exceeded", "recovery": "load_process_exit" },
    { "budget_id": "cpu.sampler_peak_cores", "target": "sampler", "metric": "cpu_peak", "unit": "cores", "window": "normal_200_rps_60s", "aggregation": "peak", "comparison": "less_equal", "threshold": 0.75, "consecutive_samples": 3, "duration_seconds": 15, "over_limit_action": "mark_observer_overhead_exceeded", "recovery": "sampler_joined" },
    { "budget_id": "cpu.collector_peak_cores", "target": "phase20-collector", "metric": "cpu_peak", "unit": "cores", "window": "normal_200_rps_60s", "aggregation": "peak", "comparison": "less_equal", "threshold": 0.5, "consecutive_samples": 3, "duration_seconds": 15, "over_limit_action": "mark_observer_overhead_exceeded", "recovery": "collector_stopped_cleanly" },
    { "budget_id": "cpu.host_busy_peak_cores", "target": "host", "metric": "busy_cpu", "unit": "cores", "window": "normal_200_rps_60s", "aggregation": "peak", "comparison": "less_equal", "threshold": 8.0, "consecutive_samples": 3, "duration_seconds": 15, "over_limit_action": "stop_current_unit_and_preserve_samples", "recovery": "host_busy_below_threshold_after_load_stop" },
    { "budget_id": "memory.sut_rss_peak", "target": "sut_containers", "metric": "rss", "unit": "bytes", "window": "normal_200_rps_60s", "aggregation": "peak", "comparison": "less_equal", "threshold": 6442450944, "consecutive_samples": 1, "duration_seconds": 5, "over_limit_action": "stop_current_unit_and_preserve_samples", "recovery": "no_oom_or_unexpected_restart" },
    { "budget_id": "memory.cgroup_current_peak", "target": "sut_containers", "metric": "memory.current", "unit": "bytes", "window": "normal_200_rps_60s", "aggregation": "peak", "comparison": "less_equal", "threshold": 8589934592, "consecutive_samples": 1, "duration_seconds": 5, "over_limit_action": "stop_current_unit_and_preserve_samples", "recovery": "all_containers_exit_normally" },
    { "budget_id": "queue.outbox_pending_peak", "target": "business_outbox", "metric": "pending", "unit": "count", "window": "normal_200_rps_60s", "aggregation": "peak", "comparison": "less_equal", "threshold": 100, "consecutive_samples": 3, "duration_seconds": 15, "over_limit_action": "preserve_backlog_and_mark_budget_exceeded", "recovery": "pending_zero_within_120s" },
    { "budget_id": "queue.rabbit_ready_peak", "target": "rabbitmq_business_queues", "metric": "ready", "unit": "count", "window": "normal_200_rps_60s", "aggregation": "peak", "comparison": "less_equal", "threshold": 50, "consecutive_samples": 3, "duration_seconds": 15, "over_limit_action": "preserve_backlog_and_mark_budget_exceeded", "recovery": "ready_zero_within_120s" },
    { "budget_id": "queue.rabbit_unacked_peak", "target": "rabbitmq_business_queues", "metric": "unacked", "unit": "count", "window": "normal_200_rps_60s", "aggregation": "peak", "comparison": "less_equal", "threshold": 16, "consecutive_samples": 3, "duration_seconds": 15, "over_limit_action": "preserve_backlog_and_mark_budget_exceeded", "recovery": "unacked_zero_within_120s" },
    { "budget_id": "queue.kafka_lag_peak", "target": "gopulse-observability-v1", "metric": "lag", "unit": "count", "window": "normal_200_rps_60s", "aggregation": "peak", "comparison": "less_equal", "threshold": 9000, "consecutive_samples": 3, "duration_seconds": 15, "over_limit_action": "preserve_offsets_and_mark_budget_exceeded", "recovery": "selected_waterline_closes_within_120s" },